{
  "$schema": "https://json-schema.org/draft/2020-12/schema",
  "$id": "https://40kdc.dev/schemas/core/stratagem.schema.json",
  "title": "Stratagem",
  "description": "A CP-costed ability usable during specific game phases.",
  "type": "object",
  "properties": {
    "id": { "$ref": "../defs/common.schema.json#/$defs/entity-id" },
    "external_refs": {
      "$ref": "../defs/common.schema.json#/$defs/external-reference-list"
    },
    "name": { "type": "string", "minLength": 1, "maxLength": 128 },
    "category": {
      "type": "string",
      "enum": ["core", "detachment"],
      "description": "Whether this is a universal core stratagem or tied to a specific detachment"
    },
    "type": {
      "type": "string",
      "enum": ["battle-tactic", "strategic-ploy", "epic-deed", "wargear"],
      "description": "GW-printed stratagem category from the card. Optional: 11e faction packs omit it for newly introduced detachments, and the category has no in-game effect; absent when the source does not state one."
    },
    "detachment_id": {
      "oneOf": [
        { "$ref": "../defs/common.schema.json#/$defs/entity-id" },
        { "type": "null" }
      ],
      "description": "Null for core stratagems"
    },
    "cp_cost": { "type": "integer", "minimum": 0, "maximum": 4 },
    "phases": { "$ref": "../defs/common.schema.json#/$defs/phase-list" },
    "player_turn": { "$ref": "../defs/common.schema.json#/$defs/player-turn" },
    "timing": {
      "type": "string",
      "enum": [
        "once-per-phase",
        "once-per-turn",
        "once-per-battle",
        "unlimited"
      ]
    },
    "target_restrictions": {
      "oneOf": [
        { "$ref": "#/$defs/stratagem-target-restriction" },
        {
          "type": "array",
          "minItems": 2,
          "items": {
            "allOf": [
              { "$ref": "#/$defs/stratagem-target-restriction" },
              { "required": ["name"] }
            ]
          },
          "description": "A Stratagem with several targets (a PSYKER model and a TZAANGORS unit): each is named, and its effect refers to each as {stratagem_target: name}. Targets in exclusive modes (\"up to two X, or one other Y\") each carry a mode: when any does, every one does and both modes a and b are present. The player chooses one mode; the targets of an unchosen mode are not selected, their eligibility is not checked, and no effect of them occurs. Targets are distinct units only within one mode.",
          "allOf": [
            {
              "if": { "contains": { "required": ["mode"] } },
              "then": {
                "items": { "required": ["mode"] },
                "allOf": [
                  { "contains": { "required": ["mode"], "properties": { "mode": { "const": "a" } } } },
                  { "contains": { "required": ["mode"], "properties": { "mode": { "const": "b" } } } }
                ]
              }
            }
          ]
        },
        { "type": "null" }
      ]
    },
    "ability_id": {
      "oneOf": [
        { "$ref": "../defs/common.schema.json#/$defs/entity-id" },
        { "type": "null" }
      ]
    },
    "game_version": { "$ref": "../defs/game-version-ref.schema.json" },
    "game_modes": {
      "$ref": "../defs/common.schema.json#/$defs/game-modes",
      "description": "Game modes this stratagem is legal or authored for; absent implies matched-play."
    }
  },
  "required": [
    "id",
    "name",
    "category",
    "cp_cost",
    "phases",
    "player_turn",
    "timing",
    "game_version"
  ],
  "additionalProperties": false,
  "$defs": {
    "stratagem-target-restriction": {
      "type": "object",
      "properties": {
        "name": {
        "$ref": "../defs/common.schema.json#/$defs/entity-id",
        "description": "Names this target when the Stratagem has several; its effect refers to it as {stratagem_target: name}."
      },
        "required_keywords": {
          "$ref": "../defs/common.schema.json#/$defs/keyword-list",
          "description": "AND set: the target must carry every keyword listed here."
        },
        "required_keywords_any": {
          "$ref": "../defs/common.schema.json#/$defs/keyword-list",
          "description": "OR set: the target must carry at least one keyword listed here. Use for rules that target a unit with one of several keywords (e.g. Crushing Impact's MONSTER/VEHICLE, Explosives' EXPLOSIVES/GRENADES). Mirrors the `army_keywords_any` OR-gate on allied-rule.schema.json."
        },
        "excluded_keywords": {
          "$ref": "../defs/common.schema.json#/$defs/keyword-list"
        },
        "count": {
          "enum": ["one", "one-or-more", "up-to"],
          "description": "How many targets are selected: one, one or more, or up to `count_max`."
        },
        "count_max": {
          "type": "integer",
          "minimum": 1,
          "description": "Upper bound when `count` is up-to (1: an optional extra target, zero or one unit)."
        },
        "side": {
          "enum": ["your-army", "enemy"],
          "description": "Whose units can be selected."
        },
        "selects": {
          "enum": ["unit", "model"],
          "description": "Whether the target is a unit or a single model."
        },
        "bound_to": {
          "enum": ["triggering-unit", "attacked-unit"],
          "description": "The target is not freely chosen: it is the unit the WHEN moment names (\"that unit\"), or the unit the triggering enemy attacked."
        },
        "eligibility": {
          "$ref": "../enrichment/ability-dsl/condition.schema.json",
          "description": "What must be true of a unit to be selected, e.g. not selected to shoot this phase, or within Engagement Range of an enemy unit."
        },
        "notes": { "type": "string" },
        "mode": {
          "enum": ["a", "b"],
          "description": "The exclusive target mode this target belongs to. Targets with the same mode are chosen together; a and b are alternatives. Set on every target when the Stratagem has modes (see target_restrictions)."
        },
        "mode_cost": {
          "type": "object",
          "required": ["label", "amount"],
          "properties": {
            "label": { "type": "string", "minLength": 1, "description": "The resource pool or resource the mode spends, as the resource-spend effect names it." },
            "amount": { "type": "integer", "minimum": 1, "description": "How many of that resource the mode spends to be chosen." }
          },
          "additionalProperties": false,
          "description": "What choosing this mode costs (\"spend 2YP and target ... instead\"). Every target of one mode carries the same mode_cost."
        }
      },
      "dependentRequired": { "mode_cost": ["mode"] },
      "additionalProperties": false,
      "allOf": [
        {
          "if": { "properties": { "count": { "const": "up-to" } }, "required": ["count"] },
          "then": { "required": ["count_max"] },
          "else": { "not": { "required": ["count_max"] } }
        }
      ]
    }
  }
}
