[
  {
    "id": "adaptive-strategy-gladius-task-force-adeptus-astartes",
    "name": "ADAPTIVE STRATEGY",
    "category": "detachment",
    "type": "strategic-ploy",
    "detachment_id": "gladius-task-force",
    "cp_cost": 1,
    "phases": [
      "command"
    ],
    "player_turn": "your-turn",
    "timing": "once-per-phase",
    "target_restrictions": {
      "required_keywords": [
        "Adeptus Astartes"
      ],
      "count": "one",
      "side": "your-army",
      "selects": "unit"
    },
    "ability_id": "adaptive-strategy-gladius-task-force-adeptus-astartes",
    "game_version": {
      "edition": "11th",
      "dataslate": "mfm-995"
    },
    "external_refs": [
      {
        "namespace": "game-datacards",
        "id": "79411679-f156-527e-ba7f-aa1f1866d76a"
      },
      {
        "namespace": "mfm",
        "id": "4daab501-a02e-45f5-b9c2-7e70913308e5"
      }
    ]
  },
  {
    "id": "ancient-fury-medusas-wrath-iron-hands",
    "external_refs": [
      {
        "namespace": "mfm",
        "id": "95aa397f-b69c-48b3-82fe-5743639b12eb"
      }
    ],
    "name": "Ancient Fury",
    "category": "detachment",
    "detachment_id": "medusas-wrath",
    "cp_cost": 1,
    "phases": [
      "command"
    ],
    "player_turn": "your-turn",
    "timing": "once-per-phase",
    "target_restrictions": {
      "required_keywords": [
        "Adeptus Astartes",
        "Dreadnought"
      ],
      "count": "one",
      "side": "your-army",
      "selects": "unit"
    },
    "ability_id": "ancient-fury-medusas-wrath-iron-hands",
    "game_version": {
      "edition": "11th",
      "dataslate": "mfm-995"
    }
  },
  {
    "id": "methodical-brutality-medusas-wrath-iron-hands",
    "external_refs": [
      {
        "namespace": "mfm",
        "id": "843d8704-6cc5-471d-b6fb-76f5725a0fd0"
      }
    ],
    "name": "Methodical Brutality",
    "category": "detachment",
    "detachment_id": "medusas-wrath",
    "cp_cost": 1,
    "phases": [
      "shooting",
      "fight"
    ],
    "player_turn": "either",
    "timing": "once-per-phase",
    "target_restrictions": {
      "required_keywords": [
        "Adeptus Astartes"
      ],
      "count": "one",
      "selects": "unit",
      "bound_to": "triggering-unit"
    },
    "ability_id": "methodical-brutality-medusas-wrath-iron-hands",
    "game_version": {
      "edition": "11th",
      "dataslate": "mfm-995"
    }
  },
  {
    "id": "power-of-the-machine-spirit-medusas-wrath-iron-hands",
    "external_refs": [
      {
        "namespace": "mfm",
        "id": "97fe8c71-ef31-454a-b4ca-a36f4edeb2a1"
      }
    ],
    "name": "Power of the Machine Spirit",
    "category": "detachment",
    "detachment_id": "medusas-wrath",
    "cp_cost": 1,
    "phases": [
      "shooting"
    ],
    "player_turn": "opponent-turn",
    "timing": "once-per-phase",
    "target_restrictions": null,
    "ability_id": "power-of-the-machine-spirit-medusas-wrath-iron-hands",
    "game_version": {
      "edition": "11th",
      "dataslate": "pre-launch-provisional"
    }
  },
  {
    "id": "spirits-of-iron-medusas-wrath-iron-hands",
    "external_refs": [
      {
        "namespace": "mfm",
        "id": "4d0061c1-fac7-486c-82d6-ab538519d64b"
      }
    ],
    "name": "Spirits of Iron",
    "category": "detachment",
    "detachment_id": "medusas-wrath",
    "cp_cost": 1,
    "phases": [
      "command",
      "movement",
      "shooting",
      "charge",
      "fight"
    ],
    "player_turn": "either",
    "timing": "once-per-phase",
    "target_restrictions": {
      "required_keywords": [
        "Adeptus Astartes"
      ],
      "count": "one",
      "selects": "unit",
      "bound_to": "triggering-unit"
    },
    "ability_id": "spirits-of-iron-medusas-wrath-iron-hands",
    "game_version": {
      "edition": "11th",
      "dataslate": "mfm-995"
    }
  },
  {
    "id": "unbowed-conviction-medusas-wrath-iron-hands",
    "external_refs": [
      {
        "namespace": "mfm",
        "id": "38f94151-439b-47f8-8ed7-6a30c87fed3a"
      }
    ],
    "name": "Unbowed Conviction",
    "category": "detachment",
    "detachment_id": "medusas-wrath",
    "cp_cost": 1,
    "phases": [
      "command"
    ],
    "player_turn": "your-turn",
    "timing": "once-per-phase",
    "target_restrictions": {
      "required_keywords": [
        "Adeptus Astartes"
      ],
      "count": "one",
      "side": "your-army",
      "selects": "unit",
      "eligibility": {
        "type": "strength",
        "parameters": {
          "below": "starting"
        }
      }
    },
    "ability_id": "unbowed-conviction-medusas-wrath-iron-hands",
    "game_version": {
      "edition": "11th",
      "dataslate": "mfm-995"
    }
  },
  {
    "id": "vengeful-animus-medusas-wrath-iron-hands",
    "external_refs": [
      {
        "namespace": "mfm",
        "id": "77d34e21-8585-4a94-8796-ac4f7427fc26"
      }
    ],
    "name": "Vengeful Animus",
    "category": "detachment",
    "detachment_id": "medusas-wrath",
    "cp_cost": 1,
    "phases": [
      "command",
      "movement",
      "shooting",
      "charge",
      "fight"
    ],
    "player_turn": "either",
    "timing": "once-per-phase",
    "target_restrictions": {
      "required_keywords": [
        "Adeptus Astartes",
        "Vehicle"
      ],
      "count": "one",
      "selects": "unit",
      "bound_to": "triggering-unit"
    },
    "ability_id": "vengeful-animus-medusas-wrath-iron-hands",
    "game_version": {
      "edition": "11th",
      "dataslate": "mfm-995"
    }
  },
  {
    "id": "wind-swift-evasion-stormlance-task-force-adeptus-astartes",
    "name": "WIND-SWIFT EVASION",
    "category": "detachment",
    "type": "strategic-ploy",
    "detachment_id": "stormlance-task-force",
    "cp_cost": 1,
    "phases": [
      "fight"
    ],
    "player_turn": "either",
    "timing": "once-per-phase",
    "target_restrictions": {
      "required_keywords": [
        "Adeptus Astartes",
        "Mounted"
      ],
      "count": "one",
      "side": "your-army",
      "selects": "unit",
      "eligibility": {
        "type": "eligible",
        "parameters": {
          "subject": "this-unit",
          "to": "fight"
        }
      }
    },
    "ability_id": "wind-swift-evasion-stormlance-task-force-adeptus-astartes",
    "game_version": {
      "edition": "11th",
      "dataslate": "mfm-995"
    },
    "external_refs": [
      {
        "namespace": "game-datacards",
        "id": "8f009121-ad40-5eb6-8339-12099275f3f6"
      },
      {
        "namespace": "mfm",
        "id": "25378f3a-afc0-4fa6-a087-2095bbebcfe9"
      }
    ]
  }
]
