[
  {
    "id": "command-re-roll",
    "name": "COMMAND RE-ROLL",
    "category": "core",
    "type": "battle-tactic",
    "detachment_id": null,
    "cp_cost": 1,
    "phases": [
      "command",
      "movement",
      "shooting",
      "charge",
      "fight"
    ],
    "player_turn": "either",
    "timing": "once-per-phase",
    "target_restrictions": null,
    "ability_id": "command-re-roll",
    "game_version": {
      "edition": "11th",
      "dataslate": "pre-launch-provisional"
    },
    "external_refs": [
      {
        "namespace": "mfm",
        "id": "423c91b3-aaa4-4629-bba6-b4ef2355cd1c"
      }
    ]
  },
  {
    "id": "counteroffensive",
    "name": "COUNTER-OFFENSIVE",
    "category": "core",
    "type": "strategic-ploy",
    "detachment_id": null,
    "cp_cost": 2,
    "phases": [
      "fight"
    ],
    "player_turn": "opponent-turn",
    "timing": "once-per-phase",
    "target_restrictions": null,
    "ability_id": "counteroffensive",
    "game_version": {
      "edition": "11th",
      "dataslate": "pre-launch-provisional"
    },
    "external_refs": [
      {
        "namespace": "mfm",
        "id": "33bd61f7-4741-4c27-a8d8-2e13b20ca121"
      }
    ]
  },
  {
    "id": "epic-challenge",
    "name": "EPIC CHALLENGE",
    "category": "core",
    "type": "epic-deed",
    "detachment_id": null,
    "cp_cost": 1,
    "phases": [
      "fight"
    ],
    "player_turn": "either",
    "timing": "once-per-phase",
    "target_restrictions": {
      "required_keywords": [
        "Character"
      ],
      "count": "one",
      "selects": "unit",
      "bound_to": "triggering-unit"
    },
    "ability_id": "epic-challenge",
    "game_version": {
      "edition": "11th",
      "dataslate": "mfm-995"
    },
    "external_refs": [
      {
        "namespace": "mfm",
        "id": "9e84ecda-6e1a-4740-9dbf-e46b609e1d74"
      }
    ]
  },
  {
    "id": "insane-bravery",
    "name": "INSANE BRAVERY",
    "category": "core",
    "type": "battle-tactic",
    "detachment_id": null,
    "cp_cost": 1,
    "phases": [
      "command"
    ],
    "player_turn": "your-turn",
    "timing": "once-per-battle",
    "target_restrictions": {
      "count": "one",
      "selects": "unit",
      "bound_to": "triggering-unit"
    },
    "ability_id": "insane-bravery",
    "game_version": {
      "edition": "11th",
      "dataslate": "mfm-995"
    },
    "external_refs": [
      {
        "namespace": "mfm",
        "id": "ab3c2b39-7af0-4602-bff9-9c218277f9fa"
      }
    ]
  },
  {
    "id": "explosives",
    "name": "EXPLOSIVES",
    "category": "core",
    "type": "wargear",
    "detachment_id": null,
    "cp_cost": 1,
    "phases": [
      "shooting"
    ],
    "player_turn": "your-turn",
    "timing": "once-per-phase",
    "target_restrictions": {
      "required_keywords_any": [
        "Explosives",
        "Grenades"
      ]
    },
    "ability_id": "explosives",
    "game_version": {
      "edition": "11th",
      "dataslate": "pre-launch-provisional"
    },
    "external_refs": [
      {
        "namespace": "mfm",
        "id": "d57d3583-efec-4344-bd18-10e13bb5ef40"
      }
    ]
  },
  {
    "id": "crushing-impact",
    "name": "CRUSHING IMPACT",
    "category": "core",
    "type": "strategic-ploy",
    "detachment_id": null,
    "cp_cost": 1,
    "phases": [
      "charge"
    ],
    "player_turn": "your-turn",
    "timing": "once-per-phase",
    "target_restrictions": {
      "required_keywords_any": [
        "Monster",
        "Vehicle"
      ]
    },
    "ability_id": "crushing-impact",
    "game_version": {
      "edition": "11th",
      "dataslate": "pre-launch-provisional"
    },
    "external_refs": [
      {
        "namespace": "mfm",
        "id": "67deb45f-23e8-492b-9372-de586c0dfd61"
      }
    ]
  },
  {
    "id": "rapid-ingress",
    "name": "RAPID INGRESS",
    "category": "core",
    "type": "strategic-ploy",
    "detachment_id": null,
    "cp_cost": 1,
    "phases": [
      "movement"
    ],
    "player_turn": "opponent-turn",
    "timing": "once-per-phase",
    "target_restrictions": {
      "excluded_keywords": [
        "Aircraft"
      ],
      "count": "one",
      "side": "your-army",
      "selects": "unit",
      "eligibility": {
        "type": "matches",
        "parameters": {
          "filter": {
            "state": "in-strategic-reserves"
          }
        }
      }
    },
    "ability_id": "rapid-ingress",
    "game_version": {
      "edition": "11th",
      "dataslate": "mfm-995"
    },
    "external_refs": [
      {
        "namespace": "mfm",
        "id": "a5e58471-6de3-4bf7-b91e-b8a0b27f058d"
      }
    ]
  },
  {
    "id": "fire-overwatch",
    "name": "FIRE OVERWATCH",
    "category": "core",
    "type": "strategic-ploy",
    "detachment_id": null,
    "cp_cost": 1,
    "phases": [
      "movement"
    ],
    "player_turn": "opponent-turn",
    "timing": "once-per-turn",
    "target_restrictions": {
      "excluded_keywords": [
        "Titanic"
      ],
      "count": "one",
      "side": "your-army",
      "selects": "unit",
      "eligibility": {
        "type": "matches",
        "parameters": {
          "filter": {
            "not_states": [
              "engaged"
            ]
          }
        }
      }
    },
    "ability_id": "fire-overwatch",
    "game_version": {
      "edition": "11th",
      "dataslate": "mfm-995"
    },
    "external_refs": [
      {
        "namespace": "mfm",
        "id": "5447addb-20a3-48e5-8db9-41b4066a39cd"
      }
    ]
  },
  {
    "id": "smokescreen",
    "name": "SMOKESCREEN",
    "category": "core",
    "type": "wargear",
    "detachment_id": null,
    "cp_cost": 1,
    "phases": [
      "shooting"
    ],
    "player_turn": "opponent-turn",
    "timing": "once-per-phase",
    "target_restrictions": {
      "required_keywords": [
        "Smoke"
      ]
    },
    "ability_id": "smokescreen",
    "game_version": {
      "edition": "11th",
      "dataslate": "pre-launch-provisional"
    },
    "external_refs": [
      {
        "namespace": "mfm",
        "id": "cef0a3bd-a7f0-49d3-8c38-96fc5dcddaca"
      }
    ]
  },
  {
    "id": "heroic-intervention",
    "name": "HEROIC INTERVENTION",
    "category": "core",
    "type": "strategic-ploy",
    "detachment_id": null,
    "cp_cost": 1,
    "phases": [
      "charge"
    ],
    "player_turn": "opponent-turn",
    "timing": "once-per-turn",
    "target_restrictions": null,
    "ability_id": "heroic-intervention",
    "game_version": {
      "edition": "11th",
      "dataslate": "pre-launch-provisional"
    },
    "external_refs": [
      {
        "namespace": "mfm",
        "id": "ab1efe2c-3ca0-4e83-820c-16d31abea44d"
      }
    ]
  }
]
